{
  "$schema": "https://json-schema.org/draft/2020-12/schema",
  "type": "object",
  "properties": {
    "$schema": {
      "type": "string",
      "description": "Path to this JSON Schema: editor autocomplete only, ignored by the loader."
    },
    "id": {
      "type": "string",
      "pattern": "^[a-z][a-z0-9_]*$",
      "description": "The sequence id; equals the file name."
    },
    "babyCarried": {
      "type": "boolean",
      "description": "Whether Papa holds the baby for the whole sequence (he is taken at the start)."
    },
    "steps": {
      "minItems": 1,
      "type": "array",
      "items": {
        "oneOf": [
          {
            "type": "object",
            "properties": {
              "kind": {
                "type": "string",
                "const": "microSleeps",
                "description": "Papa fights off sleep: micro-sleeps come at a cadence."
              },
              "durationMs": {
                "type": "integer",
                "exclusiveMinimum": 0,
                "maximum": 9007199254740991,
                "description": "How long the step lasts, in sim ms."
              },
              "gapMinMs": {
                "type": "integer",
                "exclusiveMinimum": 0,
                "maximum": 9007199254740991,
                "description": "Shortest wait between two micro-sleeps in this step, in sim ms."
              },
              "gapMaxMs": {
                "type": "integer",
                "exclusiveMinimum": 0,
                "maximum": 9007199254740991,
                "description": "Longest wait between two micro-sleeps in this step, in sim ms."
              }
            },
            "required": [
              "kind",
              "durationMs",
              "gapMinMs",
              "gapMaxMs"
            ],
            "additionalProperties": false,
            "description": "A stretch of the sequence where micro-sleeps come every gapMinMs to gapMaxMs."
          },
          {
            "type": "object",
            "properties": {
              "kind": {
                "type": "string",
                "const": "beats",
                "description": "Papa walks to the beat of a track whose tempo changes (story 4.5)."
              },
              "durationMs": {
                "type": "integer",
                "exclusiveMinimum": 0,
                "maximum": 9007199254740991,
                "description": "How long the step lasts, in sim ms. The tempo goes linearly from `bpmStart` at the first beat (`leadInMs`) to `bpmEnd` at the end of the step."
              },
              "track": {
                "type": "string",
                "pattern": "^[a-z][a-z0-9]*(_[a-z0-9]+)*$",
                "description": "Id of `feedback.json › beatTracks`: the notes, the count-in tick and the decoy sound."
              },
              "bpmStart": {
                "type": "number",
                "exclusiveMinimum": 0,
                "maximum": 300,
                "description": "Tempo of the first beat, in beats per minute."
              },
              "bpmEnd": {
                "type": "number",
                "exclusiveMinimum": 0,
                "maximum": 300,
                "description": "Tempo the ramp reaches at the end of the step, in beats per minute. A beat is placed with the tempo of the beat before it, and the last one falls before the end of the step, so this tempo itself is never played."
              },
              "leadInMs": {
                "type": "integer",
                "minimum": 0,
                "maximum": 9007199254740991,
                "description": "Wait before the first beat of the count-in, in sim ms from the start of the step."
              },
              "countInBeats": {
                "type": "integer",
                "minimum": 0,
                "maximum": 9007199254740991,
                "description": "Beats at the start that are only heard (a tap there is free), counted in beats."
              },
              "windowMs": {
                "type": "integer",
                "exclusiveMinimum": 0,
                "maximum": 9007199254740991,
                "description": "Length of the window around each judged beat, in sim ms, before the tier and the fatigue."
              },
              "decoyBeats": {
                "type": "array",
                "items": {
                  "type": "integer",
                  "minimum": 0,
                  "maximum": 9007199254740991
                },
                "description": "Judged-beat numbers (0-based, count-in excluded) after which an off-beat decoy sits halfway to the next beat. Strictly increasing."
              }
            },
            "required": [
              "kind",
              "durationMs",
              "track",
              "bpmStart",
              "bpmEnd",
              "leadInMs",
              "countInBeats",
              "windowMs",
              "decoyBeats"
            ],
            "additionalProperties": false,
            "description": "A stretch of the sequence where Papa taps to a lullaby that slows down."
          },
          {
            "type": "object",
            "properties": {
              "kind": {
                "type": "string",
                "const": "duel",
                "description": "Papa stands still before the bed and leaves at the instant the baby closes his eyes (story 4.6). The step ends when its round is won, not when its time is up."
              },
              "durationMs": {
                "type": "integer",
                "exclusiveMinimum": 0,
                "maximum": 9007199254740991,
                "description": "The longest a round of this step can take, in sim ms: the rest, the telegraph, the longest wait for the signal, the window and the tolerance must fit in it. A round ends on its result, never on this time."
              },
              "threatDef": {
                "type": "string",
                "pattern": "^[a-z][a-z0-9_]*$",
                "description": "Id of the `wait` threat (`content/threats/`, aimed at Papa) the sim spawns each round of this step."
              },
              "restMs": {
                "type": "integer",
                "minimum": 0,
                "maximum": 9007199254740991,
                "description": "The breath before each round, from the start of the step (and after each retreat) to the telegraph, in sim ms. A tap in it costs nothing."
              }
            },
            "required": [
              "kind",
              "durationMs",
              "threatDef",
              "restMs"
            ],
            "additionalProperties": false,
            "description": "A round of patience: wait for the signal, then tap (the Wait response)."
          }
        ],
        "description": "One step of a sequence."
      },
      "description": "The steps, in order. The sequence lasts the sum of their durations."
    },
    "success": {
      "oneOf": [
        {
          "type": "object",
          "properties": {
            "kind": {
              "type": "string",
              "const": "stepsDone",
              "description": "Every step ran to its end with no open response left behind."
            }
          },
          "required": [
            "kind"
          ],
          "additionalProperties": false
        }
      ],
      "description": "How the sequence is won."
    },
    "failure": {
      "oneOf": [
        {
          "type": "object",
          "properties": {
            "kind": {
              "type": "string",
              "const": "gag",
              "description": "Any gag during the sequence ends it."
            },
            "hasSnore": {
              "type": "boolean",
              "description": "Whether the failure makes Papa snore and wakes the baby (+noise)."
            }
          },
          "required": [
            "kind",
            "hasSnore"
          ],
          "additionalProperties": false
        },
        {
          "type": "object",
          "properties": {
            "kind": {
              "type": "string",
              "const": "babyAwake",
              "description": "Every miss, decoy tap and stray tap wakes the baby a little; at 100 % he is up."
            },
            "missWakePct": {
              "type": "integer",
              "minimum": 0,
              "maximum": 100,
              "description": "Wake added by a judged beat nobody tapped, in % of the way to awake."
            },
            "decoyWakePct": {
              "type": "integer",
              "minimum": 0,
              "maximum": 100,
              "description": "Wake added by a tap on a decoy, in % of the way to awake."
            },
            "strayWakePct": {
              "type": "integer",
              "minimum": 0,
              "maximum": 100,
              "description": "Wake added by a tap that is on no beat and no decoy (a second tap in a window, a tap between windows), in % of the way to awake."
            }
          },
          "required": [
            "kind",
            "missWakePct",
            "decoyWakePct",
            "strayWakePct"
          ],
          "additionalProperties": false
        },
        {
          "type": "object",
          "properties": {
            "kind": {
              "type": "string",
              "const": "retreats",
              "description": "Every gag steps the sequence back one step (the first step stays the first); the failure that makes `maxRetreats` ends it (story 4.6)."
            },
            "maxRetreats": {
              "type": "integer",
              "exclusiveMinimum": 0,
              "maximum": 9007199254740991,
              "description": "How many gags end the sequence: the last one wakes the baby, counted in gags."
            }
          },
          "required": [
            "kind",
            "maxRetreats"
          ],
          "additionalProperties": false
        }
      ],
      "description": "How the sequence is lost."
    },
    "framing": {
      "type": "object",
      "properties": {
        "camera": {
          "type": "object",
          "properties": {
            "zoomPct": {
              "type": "number",
              "minimum": 0,
              "maximum": 100,
              "description": "Extra zoom at full framing, in % of the base zoom."
            },
            "focusPct": {
              "type": "number",
              "minimum": 0,
              "maximum": 100,
              "description": "How far the camera pans toward Papa at full framing, in % of the way to him."
            },
            "inMs": {
              "type": "integer",
              "exclusiveMinimum": 0,
              "maximum": 9007199254740991,
              "description": "Time to reach full framing, in sim ms."
            },
            "outMs": {
              "type": "integer",
              "exclusiveMinimum": 0,
              "maximum": 9007199254740991,
              "description": "Time to come back after the end, in sim ms."
            }
          },
          "required": [
            "zoomPct",
            "focusPct",
            "inMs",
            "outMs"
          ],
          "additionalProperties": false,
          "description": "The light zoom on Papa while the sequence lasts (sim clock: a pause holds it)."
        },
        "musicLoop": {
          "anyOf": [
            {
              "type": "string",
              "pattern": "^[a-z][a-z0-9_]*$",
              "description": "Id of `feedback.json › loops.sequenceMusic`: the level stems give way to it."
            },
            {
              "type": "null"
            }
          ],
          "description": "The sequence music, or null for no change of music."
        },
        "bar": {
          "anyOf": [
            {
              "type": "object",
              "properties": {
                "labelKey": {
                  "type": "string",
                  "minLength": 1,
                  "description": "Key of `strings.fr.json` for the bar label (and its accessible name)."
                },
                "fill": {
                  "type": "string",
                  "enum": [
                    "opponent",
                    "player"
                  ],
                  "description": "`opponent` fills in `gauge-warn` (a boss health bar), `player` in `gauge-calm`."
                },
                "value": {
                  "type": "string",
                  "enum": [
                    "timeLeft",
                    "calmLeft"
                  ],
                  "description": "What the bar shows; `timeLeft` is the time left, `calmLeft` the baby's calm left (100 − his wake, needs a `babyAwake` failure)."
                }
              },
              "required": [
                "labelKey",
                "fill",
                "value"
              ],
              "additionalProperties": false,
              "description": "The sequence bar under the timer."
            },
            {
              "type": "null"
            }
          ],
          "description": "The bar under the timer, or null for no bar (and no compact timer)."
        }
      },
      "required": [
        "camera",
        "musicLoop",
        "bar"
      ],
      "additionalProperties": false,
      "description": "What the client shows around the sequence. The sim ignores it."
    },
    "feedback": {
      "type": "object",
      "properties": {
        "started": {
          "type": "string",
          "pattern": "^[a-z][a-z0-9_]*$",
          "description": "Cue played when the sequence starts."
        },
        "succeeded": {
          "type": "string",
          "pattern": "^[a-z][a-z0-9_]*$",
          "description": "Cue played when the sequence is won."
        },
        "failed": {
          "type": "string",
          "pattern": "^[a-z][a-z0-9_]*$",
          "description": "Cue played when the sequence is lost."
        }
      },
      "required": [
        "started",
        "succeeded",
        "failed"
      ],
      "additionalProperties": false,
      "description": "Cues of `feedback.json` › `cues` the client plays for this sequence."
    }
  },
  "required": [
    "id",
    "babyCarried",
    "steps",
    "success",
    "failure",
    "framing",
    "feedback"
  ],
  "additionalProperties": false,
  "description": "A special sequence: its steps, how it ends and how it looks (stories 4.4, 4.5)."
}
