{
  "$schema": "../../content/_schemas/sequence.schema.json",
  "id": "lullaby_walk",
  "babyCarried": true,
  "steps": [
    {
      "kind": "beats",
      "durationMs": 10000,
      "track": "lullaby",
      "bpmStart": 90,
      "bpmEnd": 60,
      "leadInMs": 1000,
      "countInBeats": 2,
      "windowMs": 180,
      "decoyBeats": [4]
    }
  ],
  "success": { "kind": "stepsDone" },
  "failure": { "kind": "babyAwake", "missWakePct": 25, "decoyWakePct": 40, "strayWakePct": 10 },
  "framing": {
    "camera": { "zoomPct": 18, "focusPct": 60, "inMs": 900, "outMs": 700 },
    "musicLoop": "lullaby_walk",
    "bar": { "labelKey": "hud.sequence_lullaby_walk", "fill": "player", "value": "calmLeft" }
  },
  "feedback": {
    "started": "sequence_started",
    "succeeded": "sequence_succeeded",
    "failed": "sequence_failed"
  }
}
