{
  "$schema": "../../content/_schemas/sequence.schema.json",
  "id": "stay_awake",
  "babyCarried": true,
  "steps": [
    { "kind": "microSleeps", "durationMs": 5000, "gapMinMs": 3000, "gapMaxMs": 4000 },
    { "kind": "microSleeps", "durationMs": 5000, "gapMinMs": 2500, "gapMaxMs": 3500 },
    { "kind": "microSleeps", "durationMs": 5000, "gapMinMs": 2000, "gapMaxMs": 3000 }
  ],
  "success": { "kind": "stepsDone" },
  "failure": { "kind": "gag", "hasSnore": true },
  "framing": {
    "camera": { "zoomPct": 18, "focusPct": 60, "inMs": 900, "outMs": 700 },
    "musicLoop": "stay_awake",
    "bar": { "labelKey": "hud.sequence_stay_awake", "fill": "opponent", "value": "timeLeft" }
  },
  "feedback": {
    "started": "sequence_started",
    "succeeded": "sequence_succeeded",
    "failed": "sequence_failed"
  }
}
